{
  "hero": {
    "title": "Offers",
    "image": {
      "src": "/media/public/storage/images/general-settings/homepage_footer_img/eV3Ocr4Tj0S4aklU3mvOn1wJLts1OWBPhKPaycHa.png",
      "alt": ""
    },
    "breadcrumb": {
      "home": {
        "label": "Home",
        "href": "#"
      },
      "current": "Running Offer"
    }
  },
  "headline": "মাত্র ৫০,০০০ টাকায় বুকিং দিলেই কক্সবাজারে ৩ দিন ৪ রাত থাকার সুযোগ",
  "paragraphs": [
    "কোলাহলমুক্ত সবুজ ও মনোরম পরিবেশে পরিবার, বন্ধু কিংবা প্রিয়জনদের সাথে কাটান আনন্দঘন ও স্মরণীয় সময়। আধুনিক সুযোগ-সুবিধা, নান্দনিক পরিবেশ এবং প্রকৃতির ছোঁয়ায় গড়ে উঠা ইনডেক্স ইকো রিসোর্ট আপনাকে দেবে প্রশান্তি ও স্বস্তির এক অনন্য অভিজ্ঞতা। সীমিত সময়ের এই বিশেষ অফারটি উপভোগ করতে আজই বুকিং সম্পন্ন করুন এবং আপনার স্বপ্নের ভ্রমণকে করে তুলুন আরও রঙিন ও উপভোগ্য।",
    "*শর্ত প্রযোজ্য"
  ],
  "note": "*শর্ত প্রযোজ্য",
  "poster": {
    "src": "/media/public/storage/images/admin/offers/Oz8yziqcPbE7N2wIsPb6JaM1VIYi9wu0RmCZ2wFb.png",
    "alt": "Krishibid Sea Palace - 5 Star Hotel Kuakata"
  }
}
